[2025-04-11T07:07:40.104+0000] {local_task_job_runner.py:123} INFO - ::group::Pre task execution logs
[2025-04-11T07:07:40.129+0000] {taskinstance.py:2614} INFO - Dependencies all met for dep_context=non-requeueable deps ti=<TaskInstance: lstm_stock_prediction_refactored.optimize_hyperparams manual__2025-04-11T07:04:52.058504+00:00 [queued]>
[2025-04-11T07:07:40.138+0000] {taskinstance.py:2614} INFO - Dependencies all met for dep_context=requeueable deps ti=<TaskInstance: lstm_stock_prediction_refactored.optimize_hyperparams manual__2025-04-11T07:04:52.058504+00:00 [queued]>
[2025-04-11T07:07:40.139+0000] {taskinstance.py:2867} INFO - Starting attempt 2 of 2
[2025-04-11T07:07:40.150+0000] {taskinstance.py:2890} INFO - Executing <Task(BashOperator): optimize_hyperparams> on 2025-04-11 07:04:52.058504+00:00
[2025-04-11T07:07:40.154+0000] {standard_task_runner.py:72} INFO - Started process 2233 to run task
[2025-04-11T07:07:40.156+0000] {standard_task_runner.py:104} INFO - Running: ['***', 'tasks', 'run', 'lstm_stock_prediction_refactored', 'optimize_hyperparams', 'manual__2025-04-11T07:04:52.058504+00:00', '--job-id', '17', '--raw', '--subdir', 'DAGS_FOLDER/lstm_refactored_dag.py', '--cfg-path', '/tmp/tmpldkubn7a']
[2025-04-11T07:07:40.158+0000] {standard_task_runner.py:105} INFO - Job 17: Subtask optimize_hyperparams
[2025-04-11T07:07:40.206+0000] {task_command.py:467} INFO - Running <TaskInstance: lstm_stock_prediction_refactored.optimize_hyperparams manual__2025-04-11T07:04:52.058504+00:00 [running]> on host 162c7a94827e
[2025-04-11T07:07:40.267+0000] {taskinstance.py:3134} INFO - Exporting env vars: AIRFLOW_CTX_DAG_OWNER='***_team' AIRFLOW_CTX_DAG_ID='lstm_stock_prediction_refactored' AIRFLOW_CTX_TASK_ID='optimize_hyperparams' AIRFLOW_CTX_EXECUTION_DATE='2025-04-11T07:04:52.058504+00:00' AIRFLOW_CTX_TRY_NUMBER='2' AIRFLOW_CTX_DAG_RUN_ID='manual__2025-04-11T07:04:52.058504+00:00'
[2025-04-11T07:07:40.273+0000] {taskinstance.py:732} INFO - ::endgroup::
[2025-04-11T07:07:40.293+0000] {subprocess.py:78} INFO - Tmp dir root location: /tmp
[2025-04-11T07:07:40.296+0000] {subprocess.py:88} INFO - Running command: ['/usr/bin/bash', '-c', 'python /opt/***/src/models/optimize_hyperparams.py --config /opt/***/config/params.yaml']
[2025-04-11T07:07:40.307+0000] {subprocess.py:99} INFO - Output:
[2025-04-11T07:07:42.462+0000] {subprocess.py:106} INFO - mkdir -p failed for path /home/***/.cache/matplotlib: [Errno 13] Permission denied: '/home/***/.cache/matplotlib'
[2025-04-11T07:07:42.467+0000] {subprocess.py:106} INFO - Matplotlib created a temporary cache directory at /tmp/matplotlib-464iz5cp because there was an issue with the default path (/home/***/.cache/matplotlib); it is highly recommended to set the MPLCONFIGDIR environment variable to a writable directory, in particular to speed up the import of Matplotlib and to better support multiprocessing.
[2025-04-11T07:07:45.205+0000] {subprocess.py:106} INFO - [I 2025-04-11 07:07:45,205] A new study created in memory with name: no-name-841b25c0-1939-4476-ba47-285baa126c53
[2025-04-11T07:07:51.191+0000] {subprocess.py:106} INFO - [I 2025-04-11 07:07:51,191] Trial 0 finished with value: 0.06499915695749223 and parameters: {'batch_size': 16, 'hidden_size': 128, 'num_layers': 2, 'dropout_rate': 0.1, 'learning_rate': 0.002302601458115994, 'model_type': 'lstm'}. Best is trial 0 with value: 0.06499915695749223.
[2025-04-11T07:08:21.545+0000] {subprocess.py:106} INFO - [I 2025-04-11 07:08:21,545] Trial 1 finished with value: 0.04991493001580238 and parameters: {'batch_size': 64, 'hidden_size': 224, 'num_layers': 3, 'dropout_rate': 0.2, 'learning_rate': 0.001269450384826666, 'model_type': 'lstm_cross_attention'}. Best is trial 1 with value: 0.04991493001580238.
[2025-04-11T07:08:22.156+0000] {subprocess.py:106} INFO - [I 2025-04-11 07:08:22,156] Trial 2 finished with value: 0.0905483290553093 and parameters: {'batch_size': 112, 'hidden_size': 96, 'num_layers': 1, 'dropout_rate': 0.30000000000000004, 'learning_rate': 0.0036131064707791523, 'model_type': 'lstm'}. Best is trial 1 with value: 0.04991493001580238.
[2025-04-11T07:08:23.437+0000] {subprocess.py:106} INFO - [I 2025-04-11 07:08:23,437] Trial 3 finished with value: 0.07834329083561897 and parameters: {'batch_size': 96, 'hidden_size': 96, 'num_layers': 1, 'dropout_rate': 0.4, 'learning_rate': 0.0017502064515586293, 'model_type': 'lstm'}. Best is trial 1 with value: 0.04991493001580238.
[2025-04-11T07:08:26.780+0000] {subprocess.py:106} INFO - [I 2025-04-11 07:08:26,780] Trial 4 finished with value: 0.06782007527848084 and parameters: {'batch_size': 64, 'hidden_size': 224, 'num_layers': 2, 'dropout_rate': 0.2, 'learning_rate': 0.00024626235281465425, 'model_type': 'lstm'}. Best is trial 1 with value: 0.04991493001580238.
[2025-04-11T07:08:32.471+0000] {subprocess.py:106} INFO - [I 2025-04-11 07:08:32,471] Trial 5 finished with value: 0.07968243286013603 and parameters: {'batch_size': 32, 'hidden_size': 192, 'num_layers': 3, 'dropout_rate': 0.30000000000000004, 'learning_rate': 0.00013010758189309148, 'model_type': 'lstm_attention'}. Best is trial 1 with value: 0.04991493001580238.
[2025-04-11T07:08:40.050+0000] {subprocess.py:106} INFO - [I 2025-04-11 07:08:40,050] Trial 6 finished with value: 0.04130486957728863 and parameters: {'batch_size': 32, 'hidden_size': 192, 'num_layers': 1, 'dropout_rate': 0.5, 'learning_rate': 0.0017679102589567037, 'model_type': 'lstm_cross_attention'}. Best is trial 6 with value: 0.04130486957728863.
[2025-04-11T07:08:43.883+0000] {subprocess.py:106} INFO - [I 2025-04-11 07:08:43,883] Trial 7 finished with value: 0.0952588964253664 and parameters: {'batch_size': 16, 'hidden_size': 192, 'num_layers': 3, 'dropout_rate': 0.5, 'learning_rate': 0.0010531361819175122, 'model_type': 'lstm_attention'}. Best is trial 6 with value: 0.04130486957728863.
[2025-04-11T07:08:48.701+0000] {subprocess.py:106} INFO - [I 2025-04-11 07:08:48,700] Trial 8 finished with value: 0.08961629662662744 and parameters: {'batch_size': 16, 'hidden_size': 224, 'num_layers': 2, 'dropout_rate': 0.30000000000000004, 'learning_rate': 0.0053446269869943195, 'model_type': 'lstm_attention'}. Best is trial 6 with value: 0.04130486957728863.
[2025-04-11T07:09:45.063+0000] {subprocess.py:106} INFO - [I 2025-04-11 07:09:45,063] Trial 9 finished with value: 0.04982629604637623 and parameters: {'batch_size': 96, 'hidden_size': 224, 'num_layers': 3, 'dropout_rate': 0.4, 'learning_rate': 0.0005425966613759355, 'model_type': 'lstm_cross_attention'}. Best is trial 6 with value: 0.04130486957728863.
[2025-04-11T07:09:46.988+0000] {subprocess.py:106} INFO - [I 2025-04-11 07:09:46,988] Trial 10 finished with value: 0.04532020376063883 and parameters: {'batch_size': 48, 'hidden_size': 32, 'num_layers': 1, 'dropout_rate': 0.5, 'learning_rate': 0.007573382308832575, 'model_type': 'lstm_cross_attention'}. Best is trial 6 with value: 0.04130486957728863.
[2025-04-11T07:09:48.128+0000] {subprocess.py:106} INFO - [I 2025-04-11 07:09:48,128] Trial 11 finished with value: 0.05169519130140543 and parameters: {'batch_size': 48, 'hidden_size': 32, 'num_layers': 1, 'dropout_rate': 0.5, 'learning_rate': 0.0077639272368995, 'model_type': 'lstm_cross_attention'}. Best is trial 6 with value: 0.04130486957728863.
[2025-04-11T07:09:49.535+0000] {subprocess.py:106} INFO - [I 2025-04-11 07:09:49,535] Trial 12 finished with value: 0.04671765398234129 and parameters: {'batch_size': 48, 'hidden_size': 32, 'num_layers': 1, 'dropout_rate': 0.5, 'learning_rate': 0.009154940120491378, 'model_type': 'lstm_cross_attention'}. Best is trial 6 with value: 0.04130486957728863.
[2025-04-11T07:09:59.703+0000] {subprocess.py:106} INFO - [I 2025-04-11 07:09:59,702] Trial 13 finished with value: 0.04058541031554341 and parameters: {'batch_size': 48, 'hidden_size': 160, 'num_layers': 1, 'dropout_rate': 0.4, 'learning_rate': 0.000592651244460516, 'model_type': 'lstm_cross_attention'}. Best is trial 13 with value: 0.04058541031554341.
[2025-04-11T07:10:09.643+0000] {subprocess.py:106} INFO - [I 2025-04-11 07:10:09,643] Trial 14 finished with value: 0.036456117406487465 and parameters: {'batch_size': 80, 'hidden_size': 160, 'num_layers': 1, 'dropout_rate': 0.4, 'learning_rate': 0.0005495498176272736, 'model_type': 'lstm_cross_attention'}. Best is trial 14 with value: 0.036456117406487465.
[2025-04-11T07:10:32.242+0000] {subprocess.py:106} INFO - [I 2025-04-11 07:10:32,242] Trial 15 finished with value: 0.040518658235669136 and parameters: {'batch_size': 80, 'hidden_size': 160, 'num_layers': 2, 'dropout_rate': 0.4, 'learning_rate': 0.00041624556555936847, 'model_type': 'lstm_cross_attention'}. Best is trial 14 with value: 0.036456117406487465.
[2025-04-11T07:10:45.667+0000] {subprocess.py:106} INFO - [I 2025-04-11 07:10:45,667] Trial 16 finished with value: 0.05431252717971802 and parameters: {'batch_size': 128, 'hidden_size': 128, 'num_layers': 2, 'dropout_rate': 0.4, 'learning_rate': 0.00042915320342027497, 'model_type': 'lstm_cross_attention'}. Best is trial 14 with value: 0.036456117406487465.
[2025-04-11T07:11:02.431+0000] {subprocess.py:106} INFO - [I 2025-04-11 07:11:02,431] Trial 17 finished with value: 0.03903017845004797 and parameters: {'batch_size': 80, 'hidden_size': 160, 'num_layers': 2, 'dropout_rate': 0.4, 'learning_rate': 0.0002431378842856364, 'model_type': 'lstm_cross_attention'}. Best is trial 14 with value: 0.036456117406487465.
[2025-04-11T07:11:09.985+0000] {subprocess.py:106} INFO - [I 2025-04-11 07:11:09,985] Trial 18 finished with value: 0.2139865979552269 and parameters: {'batch_size': 80, 'hidden_size': 96, 'num_layers': 2, 'dropout_rate': 0.2, 'learning_rate': 0.00011276719680202289, 'model_type': 'lstm_cross_attention'}. Best is trial 14 with value: 0.036456117406487465.
[2025-04-11T07:11:17.816+0000] {subprocess.py:106} INFO - [I 2025-04-11 07:11:17,816] Trial 19 finished with value: 0.06970717571675777 and parameters: {'batch_size': 96, 'hidden_size': 256, 'num_layers': 2, 'dropout_rate': 0.30000000000000004, 'learning_rate': 0.0002185088740583378, 'model_type': 'lstm_attention'}. Best is trial 14 with value: 0.036456117406487465.
[2025-04-11T07:11:17.818+0000] {subprocess.py:106} INFO - Using device: cpu
[2025-04-11T07:11:17.818+0000] {subprocess.py:106} INFO - --- Loading Scaled Data from /opt/***/data/features/split_scaled_data.npz ---
[2025-04-11T07:11:17.819+0000] {subprocess.py:106} INFO - --- Finished Loading Scaled Data ---
[2025-04-11T07:11:17.820+0000] {subprocess.py:106} INFO - --- Loading Scalers from /opt/***/data/processed/scalers.pkl ---
[2025-04-11T07:11:17.820+0000] {subprocess.py:106} INFO - --- Finished Loading Scalers ---
[2025-04-11T07:11:17.821+0000] {subprocess.py:106} INFO - --- Starting Optuna Optimization (20 trials) ---
[2025-04-11T07:11:17.821+0000] {subprocess.py:106} INFO - Early stopping at epoch 13
[2025-04-11T07:11:17.822+0000] {subprocess.py:106} INFO - Early stopping at epoch 8
[2025-04-11T07:11:17.822+0000] {subprocess.py:106} INFO - Early stopping at epoch 8
[2025-04-11T07:11:17.823+0000] {subprocess.py:106} INFO - Early stopping at epoch 10
[2025-04-11T07:11:17.823+0000] {subprocess.py:106} INFO - Early stopping at epoch 9
[2025-04-11T07:11:17.823+0000] {subprocess.py:106} INFO - Early stopping at epoch 8
[2025-04-11T07:11:17.824+0000] {subprocess.py:106} INFO - Early stopping at epoch 5
[2025-04-11T07:11:17.824+0000] {subprocess.py:106} INFO - Early stopping at epoch 7
[2025-04-11T07:11:17.825+0000] {subprocess.py:106} INFO - Early stopping at epoch 15
[2025-04-11T07:11:17.825+0000] {subprocess.py:106} INFO - Early stopping at epoch 10
[2025-04-11T07:11:17.826+0000] {subprocess.py:106} INFO - Early stopping at epoch 6
[2025-04-11T07:11:17.826+0000] {subprocess.py:106} INFO - Early stopping at epoch 7
[2025-04-11T07:11:17.826+0000] {subprocess.py:106} INFO - Early stopping at epoch 17
[2025-04-11T07:11:17.827+0000] {subprocess.py:106} INFO - Early stopping at epoch 14
[2025-04-11T07:11:17.827+0000] {subprocess.py:106} INFO - Early stopping at epoch 14
[2025-04-11T07:11:17.828+0000] {subprocess.py:106} INFO - Early stopping at epoch 11
[2025-04-11T07:11:17.828+0000] {subprocess.py:106} INFO - Early stopping at epoch 15
[2025-04-11T07:11:17.829+0000] {subprocess.py:106} INFO - --- Finished Optuna Optimization ---
[2025-04-11T07:11:17.829+0000] {subprocess.py:106} INFO - Best trial value (loss): 0.036456117406487465
[2025-04-11T07:11:17.830+0000] {subprocess.py:106} INFO - Best parameters: {'batch_size': 80, 'hidden_size': 160, 'num_layers': 1, 'dropout_rate': 0.4, 'learning_rate': 0.0005495498176272736, 'model_type': 'lstm_cross_attention'}
[2025-04-11T07:11:17.831+0000] {subprocess.py:106} INFO - --- Saving Best Parameters to /opt/***/config/best_params.json ---
[2025-04-11T07:11:17.832+0000] {subprocess.py:106} INFO - Traceback (most recent call last):
[2025-04-11T07:11:17.832+0000] {subprocess.py:106} INFO -   File "/opt/***/src/models/optimize_hyperparams.py", line 172, in <module>
[2025-04-11T07:11:17.833+0000] {subprocess.py:106} INFO -     run_optimization(args.config)
[2025-04-11T07:11:17.833+0000] {subprocess.py:106} INFO -   File "/opt/***/src/models/optimize_hyperparams.py", line 164, in run_optimization
[2025-04-11T07:11:17.834+0000] {subprocess.py:106} INFO -     with open(best_params_output_path, 'w') as f:
[2025-04-11T07:11:17.835+0000] {subprocess.py:106} INFO -          ^^^^^^^^^^^^^^^^^^^^^^^^^^^^^^^^^^
[2025-04-11T07:11:17.835+0000] {subprocess.py:106} INFO - OSError: [Errno 30] Read-only file system: '/opt/***/config/best_params.json'
[2025-04-11T07:11:18.732+0000] {subprocess.py:110} INFO - Command exited with return code 1
[2025-04-11T07:11:18.740+0000] {taskinstance.py:3313} ERROR - Task failed with exception
Traceback (most recent call last):
  File "/home/airflow/.local/lib/python3.11/site-packages/airflow/models/taskinstance.py", line 768, in _execute_task
    result = _execute_callable(context=context, **execute_callable_kwargs)
             ^^^^^^^^^^^^^^^^^^^^^^^^^^^^^^^^^^^^^^^^^^^^^^^^^^^^^^^^^^^^^
  File "/home/airflow/.local/lib/python3.11/site-packages/airflow/models/taskinstance.py", line 734, in _execute_callable
    return ExecutionCallableRunner(
           ^^^^^^^^^^^^^^^^^^^^^^^^
  File "/home/airflow/.local/lib/python3.11/site-packages/airflow/utils/operator_helpers.py", line 252, in run
    return self.func(*args, **kwargs)
           ^^^^^^^^^^^^^^^^^^^^^^^^^^
  File "/home/airflow/.local/lib/python3.11/site-packages/airflow/models/baseoperator.py", line 424, in wrapper
    return func(self, *args, **kwargs)
           ^^^^^^^^^^^^^^^^^^^^^^^^^^^
  File "/home/airflow/.local/lib/python3.11/site-packages/airflow/operators/bash.py", line 276, in execute
    raise AirflowException(
airflow.exceptions.AirflowException: Bash command failed. The command returned a non-zero exit code 1.
[2025-04-11T07:11:18.744+0000] {taskinstance.py:1226} INFO - Marking task as FAILED. dag_id=lstm_stock_prediction_refactored, task_id=optimize_hyperparams, run_id=manual__2025-04-11T07:04:52.058504+00:00, execution_date=20250411T070452, start_date=20250411T070740, end_date=20250411T071118
[2025-04-11T07:11:18.760+0000] {taskinstance.py:341} INFO - ::group::Post task execution logs
[2025-04-11T07:11:18.761+0000] {standard_task_runner.py:124} ERROR - Failed to execute job 17 for task optimize_hyperparams (Bash command failed. The command returned a non-zero exit code 1.; 2233)
Traceback (most recent call last):
  File "/home/airflow/.local/lib/python3.11/site-packages/airflow/task/task_runner/standard_task_runner.py", line 117, in _start_by_fork
    ret = args.func(args, dag=self.dag)
          ^^^^^^^^^^^^^^^^^^^^^^^^^^^^^
  File "/home/airflow/.local/lib/python3.11/site-packages/airflow/cli/cli_config.py", line 49, in command
    return func(*args, **kwargs)
           ^^^^^^^^^^^^^^^^^^^^^
  File "/home/airflow/.local/lib/python3.11/site-packages/airflow/utils/cli.py", line 116, in wrapper
    return f(*args, **kwargs)
           ^^^^^^^^^^^^^^^^^^
  File "/home/airflow/.local/lib/python3.11/site-packages/airflow/cli/commands/task_command.py", line 483, in task_run
    task_return_code = _run_task_by_selected_method(args, _dag, ti)
                       ^^^^^^^^^^^^^^^^^^^^^^^^^^^^^^^^^^^^^^^^^^^^
  File "/home/airflow/.local/lib/python3.11/site-packages/airflow/cli/commands/task_command.py", line 256, in _run_task_by_selected_method
    return _run_raw_task(args, ti)
           ^^^^^^^^^^^^^^^^^^^^^^^
  File "/home/airflow/.local/lib/python3.11/site-packages/airflow/cli/commands/task_command.py", line 341, in _run_raw_task
    return ti._run_raw_task(
           ^^^^^^^^^^^^^^^^^
  File "/home/airflow/.local/lib/python3.11/site-packages/airflow/utils/session.py", line 97, in wrapper
    return func(*args, session=session, **kwargs)
           ^^^^^^^^^^^^^^^^^^^^^^^^^^^^^^^^^^^^^^
  File "/home/airflow/.local/lib/python3.11/site-packages/airflow/models/taskinstance.py", line 3006, in _run_raw_task
    return _run_raw_task(
           ^^^^^^^^^^^^^^
  File "/home/airflow/.local/lib/python3.11/site-packages/airflow/models/taskinstance.py", line 274, in _run_raw_task
    TaskInstance._execute_task_with_callbacks(
  File "/home/airflow/.local/lib/python3.11/site-packages/airflow/models/taskinstance.py", line 3161, in _execute_task_with_callbacks
    result = self._execute_task(context, task_orig)
             ^^^^^^^^^^^^^^^^^^^^^^^^^^^^^^^^^^^^^^
  File "/home/airflow/.local/lib/python3.11/site-packages/airflow/models/taskinstance.py", line 3185, in _execute_task
    return _execute_task(self, context, task_orig)
           ^^^^^^^^^^^^^^^^^^^^^^^^^^^^^^^^^^^^^^^
  File "/home/airflow/.local/lib/python3.11/site-packages/airflow/models/taskinstance.py", line 768, in _execute_task
    result = _execute_callable(context=context, **execute_callable_kwargs)
             ^^^^^^^^^^^^^^^^^^^^^^^^^^^^^^^^^^^^^^^^^^^^^^^^^^^^^^^^^^^^^
  File "/home/airflow/.local/lib/python3.11/site-packages/airflow/models/taskinstance.py", line 734, in _execute_callable
    return ExecutionCallableRunner(
           ^^^^^^^^^^^^^^^^^^^^^^^^
  File "/home/airflow/.local/lib/python3.11/site-packages/airflow/utils/operator_helpers.py", line 252, in run
    return self.func(*args, **kwargs)
           ^^^^^^^^^^^^^^^^^^^^^^^^^^
  File "/home/airflow/.local/lib/python3.11/site-packages/airflow/models/baseoperator.py", line 424, in wrapper
    return func(self, *args, **kwargs)
           ^^^^^^^^^^^^^^^^^^^^^^^^^^^
  File "/home/airflow/.local/lib/python3.11/site-packages/airflow/operators/bash.py", line 276, in execute
    raise AirflowException(
airflow.exceptions.AirflowException: Bash command failed. The command returned a non-zero exit code 1.
[2025-04-11T07:11:18.793+0000] {local_task_job_runner.py:266} INFO - Task exited with return code 1
[2025-04-11T07:11:18.807+0000] {taskinstance.py:3901} INFO - 0 downstream tasks scheduled from follow-on schedule check
[2025-04-11T07:11:18.810+0000] {local_task_job_runner.py:245} INFO - ::endgroup::
