[2025-04-11T07:24:09.204+0000] {local_task_job_runner.py:123} INFO - ::group::Pre task execution logs
[2025-04-11T07:24:09.219+0000] {taskinstance.py:2614} INFO - Dependencies all met for dep_context=non-requeueable deps ti=<TaskInstance: lstm_stock_prediction_refactored.optimize_hyperparams manual__2025-04-11T07:04:52.058504+00:00 [queued]>
[2025-04-11T07:24:09.225+0000] {taskinstance.py:2614} INFO - Dependencies all met for dep_context=requeueable deps ti=<TaskInstance: lstm_stock_prediction_refactored.optimize_hyperparams manual__2025-04-11T07:04:52.058504+00:00 [queued]>
[2025-04-11T07:24:09.226+0000] {taskinstance.py:2867} INFO - Starting attempt 4 of 4
[2025-04-11T07:24:09.234+0000] {taskinstance.py:2890} INFO - Executing <Task(BashOperator): optimize_hyperparams> on 2025-04-11 07:04:52.058504+00:00
[2025-04-11T07:24:09.238+0000] {standard_task_runner.py:72} INFO - Started process 5250 to run task
[2025-04-11T07:24:09.240+0000] {standard_task_runner.py:104} INFO - Running: ['***', 'tasks', 'run', 'lstm_stock_prediction_refactored', 'optimize_hyperparams', 'manual__2025-04-11T07:04:52.058504+00:00', '--job-id', '19', '--raw', '--subdir', 'DAGS_FOLDER/lstm_refactored_dag.py', '--cfg-path', '/tmp/tmp11ac4nmo']
[2025-04-11T07:24:09.242+0000] {standard_task_runner.py:105} INFO - Job 19: Subtask optimize_hyperparams
[2025-04-11T07:24:09.283+0000] {task_command.py:467} INFO - Running <TaskInstance: lstm_stock_prediction_refactored.optimize_hyperparams manual__2025-04-11T07:04:52.058504+00:00 [running]> on host 162c7a94827e
[2025-04-11T07:24:09.339+0000] {taskinstance.py:3134} INFO - Exporting env vars: AIRFLOW_CTX_DAG_OWNER='***_team' AIRFLOW_CTX_DAG_ID='lstm_stock_prediction_refactored' AIRFLOW_CTX_TASK_ID='optimize_hyperparams' AIRFLOW_CTX_EXECUTION_DATE='2025-04-11T07:04:52.058504+00:00' AIRFLOW_CTX_TRY_NUMBER='4' AIRFLOW_CTX_DAG_RUN_ID='manual__2025-04-11T07:04:52.058504+00:00'
[2025-04-11T07:24:09.340+0000] {taskinstance.py:732} INFO - ::endgroup::
[2025-04-11T07:24:09.350+0000] {subprocess.py:78} INFO - Tmp dir root location: /tmp
[2025-04-11T07:24:09.351+0000] {subprocess.py:88} INFO - Running command: ['/usr/bin/bash', '-c', 'python /opt/***/src/models/optimize_hyperparams.py --config /opt/***/config/params.yaml']
[2025-04-11T07:24:09.358+0000] {subprocess.py:99} INFO - Output:
[2025-04-11T07:24:10.851+0000] {subprocess.py:106} INFO - mkdir -p failed for path /home/***/.cache/matplotlib: [Errno 13] Permission denied: '/home/***/.cache/matplotlib'
[2025-04-11T07:24:10.852+0000] {subprocess.py:106} INFO - Matplotlib created a temporary cache directory at /tmp/matplotlib-8t39f0rz because there was an issue with the default path (/home/***/.cache/matplotlib); it is highly recommended to set the MPLCONFIGDIR environment variable to a writable directory, in particular to speed up the import of Matplotlib and to better support multiprocessing.
[2025-04-11T07:24:13.210+0000] {subprocess.py:106} INFO - [I 2025-04-11 07:24:13,210] A new study created in memory with name: no-name-dc45774d-72a6-49a0-a430-cf12bbab6cd0
[2025-04-11T07:24:15.903+0000] {subprocess.py:106} INFO - [I 2025-04-11 07:24:15,902] Trial 0 finished with value: 0.37876734137535095 and parameters: {'batch_size': 128, 'hidden_size': 32, 'num_layers': 3, 'dropout_rate': 0.2, 'learning_rate': 0.00015601224804621757, 'model_type': 'lstm'}. Best is trial 0 with value: 0.37876734137535095.
[2025-04-11T07:24:21.087+0000] {subprocess.py:106} INFO - [I 2025-04-11 07:24:21,087] Trial 1 finished with value: 0.16955062747001648 and parameters: {'batch_size': 112, 'hidden_size': 256, 'num_layers': 3, 'dropout_rate': 0.30000000000000004, 'learning_rate': 0.001070012307892013, 'model_type': 'lstm_attention'}. Best is trial 1 with value: 0.16955062747001648.
[2025-04-11T07:24:22.936+0000] {subprocess.py:106} INFO - [I 2025-04-11 07:24:22,936] Trial 2 finished with value: 0.09267093054950237 and parameters: {'batch_size': 48, 'hidden_size': 128, 'num_layers': 2, 'dropout_rate': 0.1, 'learning_rate': 0.008432736786869201, 'model_type': 'lstm'}. Best is trial 2 with value: 0.09267093054950237.
[2025-04-11T07:24:25.061+0000] {subprocess.py:106} INFO - [I 2025-04-11 07:24:25,060] Trial 3 finished with value: 0.05654001235961914 and parameters: {'batch_size': 64, 'hidden_size': 64, 'num_layers': 1, 'dropout_rate': 0.5, 'learning_rate': 0.0049652332293329245, 'model_type': 'lstm_cross_attention'}. Best is trial 3 with value: 0.05654001235961914.
[2025-04-11T07:24:27.247+0000] {subprocess.py:106} INFO - [I 2025-04-11 07:24:27,247] Trial 4 finished with value: 0.06176041532307863 and parameters: {'batch_size': 48, 'hidden_size': 128, 'num_layers': 1, 'dropout_rate': 0.4, 'learning_rate': 0.0009736469490470745, 'model_type': 'lstm_attention'}. Best is trial 3 with value: 0.05654001235961914.
[2025-04-11T07:24:29.799+0000] {subprocess.py:106} INFO - [I 2025-04-11 07:24:29,799] Trial 5 finished with value: 0.06735918633639812 and parameters: {'batch_size': 16, 'hidden_size': 224, 'num_layers': 2, 'dropout_rate': 0.1, 'learning_rate': 0.0011719908477939966, 'model_type': 'lstm'}. Best is trial 3 with value: 0.05654001235961914.
[2025-04-11T07:24:34.306+0000] {subprocess.py:106} INFO - [I 2025-04-11 07:24:34,306] Trial 6 finished with value: 0.06752471420913934 and parameters: {'batch_size': 16, 'hidden_size': 128, 'num_layers': 2, 'dropout_rate': 0.5, 'learning_rate': 0.001952450643158959, 'model_type': 'lstm_attention'}. Best is trial 3 with value: 0.05654001235961914.
[2025-04-11T07:24:39.979+0000] {subprocess.py:106} INFO - [I 2025-04-11 07:24:39,979] Trial 7 finished with value: 0.07517677731812 and parameters: {'batch_size': 112, 'hidden_size': 224, 'num_layers': 2, 'dropout_rate': 0.4, 'learning_rate': 0.00119077118117936, 'model_type': 'lstm_attention'}. Best is trial 3 with value: 0.05654001235961914.
[2025-04-11T07:25:01.198+0000] {subprocess.py:106} INFO - [I 2025-04-11 07:25:01,198] Trial 8 finished with value: 0.048380366340279576 and parameters: {'batch_size': 32, 'hidden_size': 160, 'num_layers': 2, 'dropout_rate': 0.2, 'learning_rate': 0.0014842815484564676, 'model_type': 'lstm_cross_attention'}. Best is trial 8 with value: 0.048380366340279576.
[2025-04-11T07:25:22.403+0000] {subprocess.py:106} INFO - [I 2025-04-11 07:25:22,402] Trial 9 finished with value: 0.040293633565306665 and parameters: {'batch_size': 32, 'hidden_size': 160, 'num_layers': 2, 'dropout_rate': 0.5, 'learning_rate': 0.0008302999416276158, 'model_type': 'lstm_cross_attention'}. Best is trial 9 with value: 0.040293633565306665.
[2025-04-11T07:26:07.775+0000] {subprocess.py:106} INFO - [I 2025-04-11 07:26:07,775] Trial 10 finished with value: 0.046306706964969635 and parameters: {'batch_size': 80, 'hidden_size': 192, 'num_layers': 3, 'dropout_rate': 0.4, 'learning_rate': 0.00027441659383909106, 'model_type': 'lstm_cross_attention'}. Best is trial 9 with value: 0.040293633565306665.
[2025-04-11T07:27:03.240+0000] {subprocess.py:106} INFO - [I 2025-04-11 07:27:03,240] Trial 11 finished with value: 0.05457870941609144 and parameters: {'batch_size': 80, 'hidden_size': 192, 'num_layers': 3, 'dropout_rate': 0.4, 'learning_rate': 0.0002756053678808496, 'model_type': 'lstm_cross_attention'}. Best is trial 9 with value: 0.040293633565306665.
[2025-04-11T07:27:55.915+0000] {subprocess.py:106} INFO - [I 2025-04-11 07:27:55,915] Trial 12 finished with value: 0.04249123577028513 and parameters: {'batch_size': 80, 'hidden_size': 192, 'num_layers': 3, 'dropout_rate': 0.5, 'learning_rate': 0.0003743498909376313, 'model_type': 'lstm_cross_attention'}. Best is trial 9 with value: 0.040293633565306665.
[2025-04-11T07:27:59.951+0000] {subprocess.py:106} INFO - [I 2025-04-11 07:27:59,951] Trial 13 finished with value: 0.1735428422689438 and parameters: {'batch_size': 96, 'hidden_size': 96, 'num_layers': 1, 'dropout_rate': 0.5, 'learning_rate': 0.0004817526297098675, 'model_type': 'lstm_cross_attention'}. Best is trial 9 with value: 0.040293633565306665.
[2025-04-11T07:28:53.216+0000] {subprocess.py:106} INFO - [I 2025-04-11 07:28:53,216] Trial 14 finished with value: 0.05500182633598646 and parameters: {'batch_size': 64, 'hidden_size': 160, 'num_layers': 3, 'dropout_rate': 0.5, 'learning_rate': 0.0005172933369639457, 'model_type': 'lstm_cross_attention'}. Best is trial 9 with value: 0.040293633565306665.
[2025-04-11T07:29:46.834+0000] {subprocess.py:106} INFO - [I 2025-04-11 07:29:46,834] Trial 15 finished with value: 0.03731345059350133 and parameters: {'batch_size': 48, 'hidden_size': 192, 'num_layers': 2, 'dropout_rate': 0.30000000000000004, 'learning_rate': 0.00010325844110544425, 'model_type': 'lstm_cross_attention'}. Best is trial 15 with value: 0.03731345059350133.
[2025-04-11T07:30:19.159+0000] {subprocess.py:106} INFO - [I 2025-04-11 07:30:19,159] Trial 16 finished with value: 0.04186160080134869 and parameters: {'batch_size': 32, 'hidden_size': 256, 'num_layers': 2, 'dropout_rate': 0.30000000000000004, 'learning_rate': 0.0035279871944438454, 'model_type': 'lstm_cross_attention'}. Best is trial 15 with value: 0.03731345059350133.
[2025-04-11T07:30:26.811+0000] {subprocess.py:106} INFO - [I 2025-04-11 07:30:26,811] Trial 17 finished with value: 0.05296568386256695 and parameters: {'batch_size': 48, 'hidden_size': 96, 'num_layers': 1, 'dropout_rate': 0.2, 'learning_rate': 0.00010875735267392682, 'model_type': 'lstm_cross_attention'}. Best is trial 15 with value: 0.03731345059350133.
[2025-04-11T07:31:06.478+0000] {subprocess.py:106} INFO - [I 2025-04-11 07:31:06,478] Trial 18 finished with value: 0.03859716765582562 and parameters: {'batch_size': 32, 'hidden_size': 224, 'num_layers': 2, 'dropout_rate': 0.30000000000000004, 'learning_rate': 0.00015748857937851815, 'model_type': 'lstm_cross_attention'}. Best is trial 15 with value: 0.03731345059350133.
[2025-04-11T07:31:14.811+0000] {subprocess.py:106} INFO - [I 2025-04-11 07:31:14,811] Trial 19 finished with value: 0.047138126101344824 and parameters: {'batch_size': 16, 'hidden_size': 224, 'num_layers': 2, 'dropout_rate': 0.30000000000000004, 'learning_rate': 0.00010807214308455078, 'model_type': 'lstm'}. Best is trial 15 with value: 0.03731345059350133.
[2025-04-11T07:31:14.813+0000] {subprocess.py:106} INFO - Using device: cpu
[2025-04-11T07:31:14.814+0000] {subprocess.py:106} INFO - --- Loading Scaled Data from /opt/***/data/features/split_scaled_data.npz ---
[2025-04-11T07:31:14.815+0000] {subprocess.py:106} INFO - --- Finished Loading Scaled Data ---
[2025-04-11T07:31:14.816+0000] {subprocess.py:106} INFO - --- Loading Scalers from /opt/***/data/processed/scalers.pkl ---
[2025-04-11T07:31:14.816+0000] {subprocess.py:106} INFO - --- Finished Loading Scalers ---
[2025-04-11T07:31:14.817+0000] {subprocess.py:106} INFO - --- Starting Optuna Optimization (20 trials) ---
[2025-04-11T07:31:14.818+0000] {subprocess.py:106} INFO - Early stopping at epoch 5
[2025-04-11T07:31:14.818+0000] {subprocess.py:106} INFO - Early stopping at epoch 10
[2025-04-11T07:31:14.819+0000] {subprocess.py:106} INFO - Early stopping at epoch 8
[2025-04-11T07:31:14.819+0000] {subprocess.py:106} INFO - Early stopping at epoch 14
[2025-04-11T07:31:14.820+0000] {subprocess.py:106} INFO - Early stopping at epoch 5
[2025-04-11T07:31:14.820+0000] {subprocess.py:106} INFO - Early stopping at epoch 12
[2025-04-11T07:31:14.821+0000] {subprocess.py:106} INFO - Early stopping at epoch 10
[2025-04-11T07:31:14.821+0000] {subprocess.py:106} INFO - Early stopping at epoch 10
[2025-04-11T07:31:14.822+0000] {subprocess.py:106} INFO - Early stopping at epoch 10
[2025-04-11T07:31:14.822+0000] {subprocess.py:106} INFO - Early stopping at epoch 12
[2025-04-11T07:31:14.822+0000] {subprocess.py:106} INFO - Early stopping at epoch 15
[2025-04-11T07:31:14.823+0000] {subprocess.py:106} INFO - Early stopping at epoch 13
[2025-04-11T07:31:14.823+0000] {subprocess.py:106} INFO - Early stopping at epoch 7
[2025-04-11T07:31:14.824+0000] {subprocess.py:106} INFO - Early stopping at epoch 15
[2025-04-11T07:31:14.824+0000] {subprocess.py:106} INFO - Early stopping at epoch 7
[2025-04-11T07:31:14.825+0000] {subprocess.py:106} INFO - Early stopping at epoch 19
[2025-04-11T07:31:14.825+0000] {subprocess.py:106} INFO - Early stopping at epoch 12
[2025-04-11T07:31:14.825+0000] {subprocess.py:106} INFO - --- Finished Optuna Optimization ---
[2025-04-11T07:31:14.826+0000] {subprocess.py:106} INFO - Best trial value (loss): 0.03731345059350133
[2025-04-11T07:31:14.826+0000] {subprocess.py:106} INFO - Best parameters: {'batch_size': 48, 'hidden_size': 192, 'num_layers': 2, 'dropout_rate': 0.30000000000000004, 'learning_rate': 0.00010325844110544425, 'model_type': 'lstm_cross_attention'}
[2025-04-11T07:31:14.827+0000] {subprocess.py:106} INFO - --- Saving Best Parameters to /opt/***/config/best_params.json ---
[2025-04-11T07:31:14.827+0000] {subprocess.py:106} INFO - Traceback (most recent call last):
[2025-04-11T07:31:14.828+0000] {subprocess.py:106} INFO -   File "/opt/***/src/models/optimize_hyperparams.py", line 172, in <module>
[2025-04-11T07:31:14.828+0000] {subprocess.py:106} INFO -     run_optimization(args.config)
[2025-04-11T07:31:14.829+0000] {subprocess.py:106} INFO -   File "/opt/***/src/models/optimize_hyperparams.py", line 164, in run_optimization
[2025-04-11T07:31:14.829+0000] {subprocess.py:106} INFO -     with open(best_params_output_path, 'w') as f:
[2025-04-11T07:31:14.829+0000] {subprocess.py:106} INFO -          ^^^^^^^^^^^^^^^^^^^^^^^^^^^^^^^^^^
[2025-04-11T07:31:14.830+0000] {subprocess.py:106} INFO - OSError: [Errno 30] Read-only file system: '/opt/***/config/best_params.json'
[2025-04-11T07:31:15.798+0000] {subprocess.py:110} INFO - Command exited with return code 1
[2025-04-11T07:31:15.807+0000] {taskinstance.py:3313} ERROR - Task failed with exception
Traceback (most recent call last):
  File "/home/airflow/.local/lib/python3.11/site-packages/airflow/models/taskinstance.py", line 768, in _execute_task
    result = _execute_callable(context=context, **execute_callable_kwargs)
             ^^^^^^^^^^^^^^^^^^^^^^^^^^^^^^^^^^^^^^^^^^^^^^^^^^^^^^^^^^^^^
  File "/home/airflow/.local/lib/python3.11/site-packages/airflow/models/taskinstance.py", line 734, in _execute_callable
    return ExecutionCallableRunner(
           ^^^^^^^^^^^^^^^^^^^^^^^^
  File "/home/airflow/.local/lib/python3.11/site-packages/airflow/utils/operator_helpers.py", line 252, in run
    return self.func(*args, **kwargs)
           ^^^^^^^^^^^^^^^^^^^^^^^^^^
  File "/home/airflow/.local/lib/python3.11/site-packages/airflow/models/baseoperator.py", line 424, in wrapper
    return func(self, *args, **kwargs)
           ^^^^^^^^^^^^^^^^^^^^^^^^^^^
  File "/home/airflow/.local/lib/python3.11/site-packages/airflow/operators/bash.py", line 276, in execute
    raise AirflowException(
airflow.exceptions.AirflowException: Bash command failed. The command returned a non-zero exit code 1.
[2025-04-11T07:31:15.810+0000] {taskinstance.py:1226} INFO - Marking task as FAILED. dag_id=lstm_stock_prediction_refactored, task_id=optimize_hyperparams, run_id=manual__2025-04-11T07:04:52.058504+00:00, execution_date=20250411T070452, start_date=20250411T072409, end_date=20250411T073115
[2025-04-11T07:31:15.828+0000] {taskinstance.py:341} INFO - ::group::Post task execution logs
[2025-04-11T07:31:15.829+0000] {standard_task_runner.py:124} ERROR - Failed to execute job 19 for task optimize_hyperparams (Bash command failed. The command returned a non-zero exit code 1.; 5250)
Traceback (most recent call last):
  File "/home/airflow/.local/lib/python3.11/site-packages/airflow/task/task_runner/standard_task_runner.py", line 117, in _start_by_fork
    ret = args.func(args, dag=self.dag)
          ^^^^^^^^^^^^^^^^^^^^^^^^^^^^^
  File "/home/airflow/.local/lib/python3.11/site-packages/airflow/cli/cli_config.py", line 49, in command
    return func(*args, **kwargs)
           ^^^^^^^^^^^^^^^^^^^^^
  File "/home/airflow/.local/lib/python3.11/site-packages/airflow/utils/cli.py", line 116, in wrapper
    return f(*args, **kwargs)
           ^^^^^^^^^^^^^^^^^^
  File "/home/airflow/.local/lib/python3.11/site-packages/airflow/cli/commands/task_command.py", line 483, in task_run
    task_return_code = _run_task_by_selected_method(args, _dag, ti)
                       ^^^^^^^^^^^^^^^^^^^^^^^^^^^^^^^^^^^^^^^^^^^^
  File "/home/airflow/.local/lib/python3.11/site-packages/airflow/cli/commands/task_command.py", line 256, in _run_task_by_selected_method
    return _run_raw_task(args, ti)
           ^^^^^^^^^^^^^^^^^^^^^^^
  File "/home/airflow/.local/lib/python3.11/site-packages/airflow/cli/commands/task_command.py", line 341, in _run_raw_task
    return ti._run_raw_task(
           ^^^^^^^^^^^^^^^^^
  File "/home/airflow/.local/lib/python3.11/site-packages/airflow/utils/session.py", line 97, in wrapper
    return func(*args, session=session, **kwargs)
           ^^^^^^^^^^^^^^^^^^^^^^^^^^^^^^^^^^^^^^
  File "/home/airflow/.local/lib/python3.11/site-packages/airflow/models/taskinstance.py", line 3006, in _run_raw_task
    return _run_raw_task(
           ^^^^^^^^^^^^^^
  File "/home/airflow/.local/lib/python3.11/site-packages/airflow/models/taskinstance.py", line 274, in _run_raw_task
    TaskInstance._execute_task_with_callbacks(
  File "/home/airflow/.local/lib/python3.11/site-packages/airflow/models/taskinstance.py", line 3161, in _execute_task_with_callbacks
    result = self._execute_task(context, task_orig)
             ^^^^^^^^^^^^^^^^^^^^^^^^^^^^^^^^^^^^^^
  File "/home/airflow/.local/lib/python3.11/site-packages/airflow/models/taskinstance.py", line 3185, in _execute_task
    return _execute_task(self, context, task_orig)
           ^^^^^^^^^^^^^^^^^^^^^^^^^^^^^^^^^^^^^^^
  File "/home/airflow/.local/lib/python3.11/site-packages/airflow/models/taskinstance.py", line 768, in _execute_task
    result = _execute_callable(context=context, **execute_callable_kwargs)
             ^^^^^^^^^^^^^^^^^^^^^^^^^^^^^^^^^^^^^^^^^^^^^^^^^^^^^^^^^^^^^
  File "/home/airflow/.local/lib/python3.11/site-packages/airflow/models/taskinstance.py", line 734, in _execute_callable
    return ExecutionCallableRunner(
           ^^^^^^^^^^^^^^^^^^^^^^^^
  File "/home/airflow/.local/lib/python3.11/site-packages/airflow/utils/operator_helpers.py", line 252, in run
    return self.func(*args, **kwargs)
           ^^^^^^^^^^^^^^^^^^^^^^^^^^
  File "/home/airflow/.local/lib/python3.11/site-packages/airflow/models/baseoperator.py", line 424, in wrapper
    return func(self, *args, **kwargs)
           ^^^^^^^^^^^^^^^^^^^^^^^^^^^
  File "/home/airflow/.local/lib/python3.11/site-packages/airflow/operators/bash.py", line 276, in execute
    raise AirflowException(
airflow.exceptions.AirflowException: Bash command failed. The command returned a non-zero exit code 1.
[2025-04-11T07:31:15.846+0000] {local_task_job_runner.py:266} INFO - Task exited with return code 1
[2025-04-11T07:31:15.860+0000] {taskinstance.py:3901} INFO - 0 downstream tasks scheduled from follow-on schedule check
[2025-04-11T07:31:15.864+0000] {local_task_job_runner.py:245} INFO - ::endgroup::
