[2025-04-14T08:21:37.211+0000] {subprocess.py:106} INFO - [I 2025-04-14 08:21:37,211] Trial 49 finished with value: 0.03851506362358729 and parameters: {'batch_size': 64, 'hidden_size': 192, 'num_layers': 1, 'dropout_rate': 0.4, 'learning_rate': 0.0013470978272141665, 'model_type': 'lstm_cross_attention'}. Best is trial 37 with value: 0.014010190684348344.
[2025-04-14T08:21:37.215+0000] {subprocess.py:106} INFO - Using device: cpu
[2025-04-14T08:21:37.216+0000] {subprocess.py:106} INFO - --- Loading Scaled Data from /opt/***/data/features/split_scaled_data.npz ---
[2025-04-14T08:21:37.217+0000] {subprocess.py:106} INFO - --- Finished Loading Scaled Data ---
[2025-04-14T08:21:37.218+0000] {subprocess.py:106} INFO - --- Loading Scalers from /opt/***/data/processed/scalers.pkl ---
[2025-04-14T08:21:37.218+0000] {subprocess.py:106} INFO - --- Finished Loading Scalers ---
[2025-04-14T08:21:37.219+0000] {subprocess.py:106} INFO - --- Starting Optuna Optimization (50 trials) ---
[2025-04-14T08:21:37.219+0000] {subprocess.py:106} INFO - Early stopping at epoch 14
[2025-04-14T08:21:37.220+0000] {subprocess.py:106} INFO - Early stopping at epoch 7
[2025-04-14T08:21:37.220+0000] {subprocess.py:106} INFO - Early stopping at epoch 7
[2025-04-14T08:21:37.220+0000] {subprocess.py:106} INFO - Early stopping at epoch 16
[2025-04-14T08:21:37.221+0000] {subprocess.py:106} INFO - Early stopping at epoch 18
[2025-04-14T08:21:37.222+0000] {subprocess.py:106} INFO - Early stopping at epoch 18
[2025-04-14T08:21:37.222+0000] {subprocess.py:106} INFO - Early stopping at epoch 9
[2025-04-14T08:21:37.223+0000] {subprocess.py:106} INFO - Early stopping at epoch 9
[2025-04-14T08:21:37.223+0000] {subprocess.py:106} INFO - Early stopping at epoch 12
[2025-04-14T08:21:37.224+0000] {subprocess.py:106} INFO - Early stopping at epoch 15
[2025-04-14T08:21:37.225+0000] {subprocess.py:106} INFO - Early stopping at epoch 19
[2025-04-14T08:21:37.225+0000] {subprocess.py:106} INFO - Early stopping at epoch 13
[2025-04-14T08:21:37.226+0000] {subprocess.py:106} INFO - Early stopping at epoch 10
[2025-04-14T08:21:37.226+0000] {subprocess.py:106} INFO - Early stopping at epoch 13
[2025-04-14T08:21:37.227+0000] {subprocess.py:106} INFO - Early stopping at epoch 13
[2025-04-14T08:21:37.227+0000] {subprocess.py:106} INFO - Early stopping at epoch 13
[2025-04-14T08:21:37.228+0000] {subprocess.py:106} INFO - Early stopping at epoch 11
[2025-04-14T08:21:37.228+0000] {subprocess.py:106} INFO - Early stopping at epoch 5
[2025-04-14T08:21:37.229+0000] {subprocess.py:106} INFO - Early stopping at epoch 8
[2025-04-14T08:21:37.229+0000] {subprocess.py:106} INFO - Early stopping at epoch 15
[2025-04-14T08:21:37.229+0000] {subprocess.py:106} INFO - Early stopping at epoch 17
[2025-04-14T08:21:37.230+0000] {subprocess.py:106} INFO - Early stopping at epoch 8
[2025-04-14T08:21:37.230+0000] {subprocess.py:106} INFO - Early stopping at epoch 8
[2025-04-14T08:21:37.231+0000] {subprocess.py:106} INFO - Early stopping at epoch 13
[2025-04-14T08:21:37.231+0000] {subprocess.py:106} INFO - Early stopping at epoch 14
[2025-04-14T08:21:37.231+0000] {subprocess.py:106} INFO - Early stopping at epoch 14
[2025-04-14T08:21:37.232+0000] {subprocess.py:106} INFO - Early stopping at epoch 7
[2025-04-14T08:21:37.232+0000] {subprocess.py:106} INFO - Early stopping at epoch 17
[2025-04-14T08:21:37.233+0000] {subprocess.py:106} INFO - Early stopping at epoch 11
[2025-04-14T08:21:37.233+0000] {subprocess.py:106} INFO - Early stopping at epoch 17
[2025-04-14T08:21:37.234+0000] {subprocess.py:106} INFO - Early stopping at epoch 14
[2025-04-14T08:21:37.234+0000] {subprocess.py:106} INFO - Early stopping at epoch 14
[2025-04-14T08:21:37.235+0000] {subprocess.py:106} INFO - Early stopping at epoch 16
[2025-04-14T08:21:37.235+0000] {subprocess.py:106} INFO - Early stopping at epoch 11
[2025-04-14T08:21:37.235+0000] {subprocess.py:106} INFO - Early stopping at epoch 14
[2025-04-14T08:21:37.236+0000] {subprocess.py:106} INFO - Early stopping at epoch 12
[2025-04-14T08:21:37.236+0000] {subprocess.py:106} INFO - Early stopping at epoch 9
[2025-04-14T08:21:37.237+0000] {subprocess.py:106} INFO - Early stopping at epoch 16
[2025-04-14T08:21:37.237+0000] {subprocess.py:106} INFO - Early stopping at epoch 7
[2025-04-14T08:21:37.238+0000] {subprocess.py:106} INFO - Early stopping at epoch 7
[2025-04-14T08:21:37.238+0000] {subprocess.py:106} INFO - Early stopping at epoch 11
[2025-04-14T08:21:37.239+0000] {subprocess.py:106} INFO - Early stopping at epoch 16
[2025-04-14T08:21:37.239+0000] {subprocess.py:106} INFO - --- Finished Optuna Optimization ---
[2025-04-14T08:21:37.240+0000] {subprocess.py:106} INFO - Best trial value (loss): 0.014010190684348344
[2025-04-14T08:21:37.240+0000] {subprocess.py:106} INFO - Best parameters: {'batch_size': 16, 'hidden_size': 128, 'num_layers': 1, 'dropout_rate': 0.30000000000000004, 'learning_rate': 0.0034994428915323724, 'model_type': 'lstm_cross_attention'}
[2025-04-14T08:21:37.241+0000] {subprocess.py:106} INFO - --- Saving Best Parameters to /opt/***/config/best_params.json ---
[2025-04-14T08:21:37.241+0000] {subprocess.py:106} INFO - --- Finished Saving Best Parameters ---
[2025-04-14T08:21:38.591+0000] {subprocess.py:110} INFO - Command exited with return code 0
[2025-04-14T08:21:38.618+0000] {taskinstance.py:341} INFO - ::group::Post task execution logs
[2025-04-14T08:21:38.619+0000] {taskinstance.py:353} INFO - Marking task as SUCCESS. dag_id=lstm_stock_prediction_refactored, task_id=optimize_hyperparams, run_id=scheduled__2025-04-07T08:00:00+00:00, execution_date=20250407T080000, start_date=20250414T080005, end_date=20250414T082138
[2025-04-14T08:21:38.681+0000] {local_task_job_runner.py:266} INFO - Task exited with return code 0
[2025-04-14T08:21:38.703+0000] {taskinstance.py:3901} INFO - 1 downstream tasks scheduled from follow-on schedule check
[2025-04-14T08:21:38.706+0000] {local_task_job_runner.py:245} INFO - ::endgroup::
