[2025-04-12T04:44:13.349+0000] {subprocess.py:106} INFO - [I 2025-04-12 04:44:13,349] Trial 49 finished with value: 0.04579531401395798 and parameters: {'batch_size': 64, 'hidden_size': 128, 'num_layers': 1, 'dropout_rate': 0.2, 'learning_rate': 0.0011116272487257512, 'model_type': 'lstm_cross_attention'}. Best is trial 46 with value: 0.030808929353952408.
[2025-04-12T04:44:13.353+0000] {subprocess.py:106} INFO - Using device: cpu
[2025-04-12T04:44:13.354+0000] {subprocess.py:106} INFO - --- Loading Scaled Data from /opt/***/data/features/split_scaled_data.npz ---
[2025-04-12T04:44:13.355+0000] {subprocess.py:106} INFO - --- Finished Loading Scaled Data ---
[2025-04-12T04:44:13.355+0000] {subprocess.py:106} INFO - --- Loading Scalers from /opt/***/data/processed/scalers.pkl ---
[2025-04-12T04:44:13.356+0000] {subprocess.py:106} INFO - --- Finished Loading Scalers ---
[2025-04-12T04:44:13.357+0000] {subprocess.py:106} INFO - --- Starting Optuna Optimization (50 trials) ---
[2025-04-12T04:44:13.357+0000] {subprocess.py:106} INFO - Early stopping at epoch 8
[2025-04-12T04:44:13.358+0000] {subprocess.py:106} INFO - Early stopping at epoch 11
[2025-04-12T04:44:13.358+0000] {subprocess.py:106} INFO - Early stopping at epoch 14
[2025-04-12T04:44:13.359+0000] {subprocess.py:106} INFO - Early stopping at epoch 7
[2025-04-12T04:44:13.359+0000] {subprocess.py:106} INFO - Early stopping at epoch 9
[2025-04-12T04:44:13.360+0000] {subprocess.py:106} INFO - Early stopping at epoch 10
[2025-04-12T04:44:13.360+0000] {subprocess.py:106} INFO - Early stopping at epoch 5
[2025-04-12T04:44:13.361+0000] {subprocess.py:106} INFO - Early stopping at epoch 13
[2025-04-12T04:44:13.361+0000] {subprocess.py:106} INFO - Early stopping at epoch 19
[2025-04-12T04:44:13.362+0000] {subprocess.py:106} INFO - Early stopping at epoch 15
[2025-04-12T04:44:13.362+0000] {subprocess.py:106} INFO - Early stopping at epoch 19
[2025-04-12T04:44:13.363+0000] {subprocess.py:106} INFO - Early stopping at epoch 19
[2025-04-12T04:44:13.363+0000] {subprocess.py:106} INFO - Early stopping at epoch 11
[2025-04-12T04:44:13.363+0000] {subprocess.py:106} INFO - Early stopping at epoch 12
[2025-04-12T04:44:13.364+0000] {subprocess.py:106} INFO - Early stopping at epoch 8
[2025-04-12T04:44:13.364+0000] {subprocess.py:106} INFO - Early stopping at epoch 10
[2025-04-12T04:44:13.365+0000] {subprocess.py:106} INFO - Early stopping at epoch 11
[2025-04-12T04:44:13.365+0000] {subprocess.py:106} INFO - Early stopping at epoch 6
[2025-04-12T04:44:13.366+0000] {subprocess.py:106} INFO - Early stopping at epoch 15
[2025-04-12T04:44:13.366+0000] {subprocess.py:106} INFO - Early stopping at epoch 13
[2025-04-12T04:44:13.366+0000] {subprocess.py:106} INFO - Early stopping at epoch 8
[2025-04-12T04:44:13.367+0000] {subprocess.py:106} INFO - Early stopping at epoch 14
[2025-04-12T04:44:13.367+0000] {subprocess.py:106} INFO - Early stopping at epoch 9
[2025-04-12T04:44:13.368+0000] {subprocess.py:106} INFO - Early stopping at epoch 12
[2025-04-12T04:44:13.368+0000] {subprocess.py:106} INFO - Early stopping at epoch 8
[2025-04-12T04:44:13.369+0000] {subprocess.py:106} INFO - Early stopping at epoch 10
[2025-04-12T04:44:13.369+0000] {subprocess.py:106} INFO - Early stopping at epoch 15
[2025-04-12T04:44:13.370+0000] {subprocess.py:106} INFO - Early stopping at epoch 14
[2025-04-12T04:44:13.371+0000] {subprocess.py:106} INFO - Early stopping at epoch 11
[2025-04-12T04:44:13.371+0000] {subprocess.py:106} INFO - Early stopping at epoch 16
[2025-04-12T04:44:13.372+0000] {subprocess.py:106} INFO - Early stopping at epoch 14
[2025-04-12T04:44:13.373+0000] {subprocess.py:106} INFO - Early stopping at epoch 16
[2025-04-12T04:44:13.374+0000] {subprocess.py:106} INFO - Early stopping at epoch 12
[2025-04-12T04:44:13.374+0000] {subprocess.py:106} INFO - Early stopping at epoch 9
[2025-04-12T04:44:13.375+0000] {subprocess.py:106} INFO - Early stopping at epoch 13
[2025-04-12T04:44:13.376+0000] {subprocess.py:106} INFO - Early stopping at epoch 14
[2025-04-12T04:44:13.376+0000] {subprocess.py:106} INFO - Early stopping at epoch 19
[2025-04-12T04:44:13.377+0000] {subprocess.py:106} INFO - Early stopping at epoch 17
[2025-04-12T04:44:13.378+0000] {subprocess.py:106} INFO - Early stopping at epoch 16
[2025-04-12T04:44:13.378+0000] {subprocess.py:106} INFO - Early stopping at epoch 10
[2025-04-12T04:44:13.378+0000] {subprocess.py:106} INFO - Early stopping at epoch 6
[2025-04-12T04:44:13.379+0000] {subprocess.py:106} INFO - Early stopping at epoch 11
[2025-04-12T04:44:13.379+0000] {subprocess.py:106} INFO - Early stopping at epoch 8
[2025-04-12T04:44:13.380+0000] {subprocess.py:106} INFO - --- Finished Optuna Optimization ---
[2025-04-12T04:44:13.380+0000] {subprocess.py:106} INFO - Best trial value (loss): 0.030808929353952408
[2025-04-12T04:44:13.380+0000] {subprocess.py:106} INFO - Best parameters: {'batch_size': 64, 'hidden_size': 192, 'num_layers': 1, 'dropout_rate': 0.1, 'learning_rate': 0.0009609766727669845, 'model_type': 'lstm_cross_attention'}
[2025-04-12T04:44:13.381+0000] {subprocess.py:106} INFO - --- Saving Best Parameters to /opt/***/config/best_params.json ---
[2025-04-12T04:44:13.381+0000] {subprocess.py:106} INFO - --- Finished Saving Best Parameters ---
[2025-04-12T04:44:14.475+0000] {subprocess.py:110} INFO - Command exited with return code 0
[2025-04-12T04:44:14.496+0000] {taskinstance.py:341} INFO - ::group::Post task execution logs
[2025-04-12T04:44:14.497+0000] {taskinstance.py:353} INFO - Marking task as SUCCESS. dag_id=lstm_stock_prediction_refactored, task_id=optimize_hyperparams, run_id=manual__2025-04-12T04:33:26.024226+00:00, execution_date=20250412T043326, start_date=20250412T043332, end_date=20250412T044414
[2025-04-12T04:44:14.541+0000] {local_task_job_runner.py:266} INFO - Task exited with return code 0
[2025-04-12T04:44:14.560+0000] {taskinstance.py:3901} INFO - 1 downstream tasks scheduled from follow-on schedule check
[2025-04-12T04:44:14.561+0000] {local_task_job_runner.py:245} INFO - ::endgroup::
